{
  "motion_library_id": "motionlib:humanoid.v1.core@1",
  "skeleton_profile_id": "humanoid.v1",
  "animation_library_ref": "res://assets/motion_library/approved/humanoid.v1/street_locomotion.tres",
  "clips": {
    "idle": {
      "clip_ref": "idle",
      "duration_seconds": 2.0,
      "track_count": 68,
      "canonical_bone_ids": [
        "root",
        "pelvis",
        "spine_lower",
        "spine_mid",
        "spine_upper",
        "neck",
        "head",
        "jaw",
        "eye_l",
        "eye_r",
        "clavicle_l",
        "upper_arm_l",
        "lower_arm_l",
        "hand_l",
        "thumb_01_l",
        "thumb_02_l",
        "thumb_03_l",
        "index_01_l",
        "index_02_l",
        "index_03_l",
        "middle_01_l",
        "middle_02_l",
        "middle_03_l",
        "ring_01_l",
        "ring_02_l",
        "ring_03_l",
        "pinky_01_l",
        "pinky_02_l",
        "pinky_03_l",
        "clavicle_r",
        "upper_arm_r",
        "lower_arm_r",
        "hand_r",
        "thumb_01_r",
        "thumb_02_r",
        "thumb_03_r",
        "index_01_r",
        "index_02_r",
        "index_03_r",
        "middle_01_r",
        "middle_02_r",
        "middle_03_r",
        "ring_01_r",
        "ring_02_r",
        "ring_03_r",
        "pinky_01_r",
        "pinky_02_r",
        "pinky_03_r",
        "thigh_l",
        "calf_l",
        "foot_l",
        "toe_l",
        "thigh_r",
        "calf_r",
        "foot_r",
        "toe_r",
        "heel_l",
        "heel_r",
        "shoulder_l",
        "shoulder_r",
        "forearm_twist_l",
        "forearm_twist_r",
        "upperarm_twist_l",
        "upperarm_twist_r",
        "thigh_twist_l",
        "thigh_twist_r",
        "calf_twist_l",
        "calf_twist_r"
      ],
      "loop_mode": "linear"
    },
    "walking2": {
      "clip_ref": "walking2",
      "duration_seconds": 1.0,
      "track_count": 68,
      "canonical_bone_ids": [
        "root",
        "pelvis",
        "spine_lower",
        "spine_mid",
        "spine_upper",
        "neck",
        "head",
        "jaw",
        "eye_l",
        "eye_r",
        "clavicle_l",
        "upper_arm_l",
        "lower_arm_l",
        "hand_l",
        "thumb_01_l",
        "thumb_02_l",
        "thumb_03_l",
        "index_01_l",
        "index_02_l",
        "index_03_l",
        "middle_01_l",
        "middle_02_l",
        "middle_03_l",
        "ring_01_l",
        "ring_02_l",
        "ring_03_l",
        "pinky_01_l",
        "pinky_02_l",
        "pinky_03_l",
        "clavicle_r",
        "upper_arm_r",
        "lower_arm_r",
        "hand_r",
        "thumb_01_r",
        "thumb_02_r",
        "thumb_03_r",
        "index_01_r",
        "index_02_r",
        "index_03_r",
        "middle_01_r",
        "middle_02_r",
        "middle_03_r",
        "ring_01_r",
        "ring_02_r",
        "ring_03_r",
        "pinky_01_r",
        "pinky_02_r",
        "pinky_03_r",
        "thigh_l",
        "calf_l",
        "foot_l",
        "toe_l",
        "thigh_r",
        "calf_r",
        "foot_r",
        "toe_r",
        "heel_l",
        "heel_r",
        "shoulder_l",
        "shoulder_r",
        "forearm_twist_l",
        "forearm_twist_r",
        "upperarm_twist_l",
        "upperarm_twist_r",
        "thigh_twist_l",
        "thigh_twist_r",
        "calf_twist_l",
        "calf_twist_r"
      ],
      "loop_mode": "linear"
    },
    "running": {
      "clip_ref": "running",
      "duration_seconds": 0.8,
      "track_count": 68,
      "canonical_bone_ids": [
        "root",
        "pelvis",
        "spine_lower",
        "spine_mid",
        "spine_upper",
        "neck",
        "head",
        "jaw",
        "eye_l",
        "eye_r",
        "clavicle_l",
        "upper_arm_l",
        "lower_arm_l",
        "hand_l",
        "thumb_01_l",
        "thumb_02_l",
        "thumb_03_l",
        "index_01_l",
        "index_02_l",
        "index_03_l",
        "middle_01_l",
        "middle_02_l",
        "middle_03_l",
        "ring_01_l",
        "ring_02_l",
        "ring_03_l",
        "pinky_01_l",
        "pinky_02_l",
        "pinky_03_l",
        "clavicle_r",
        "upper_arm_r",
        "lower_arm_r",
        "hand_r",
        "thumb_01_r",
        "thumb_02_r",
        "thumb_03_r",
        "index_01_r",
        "index_02_r",
        "index_03_r",
        "middle_01_r",
        "middle_02_r",
        "middle_03_r",
        "ring_01_r",
        "ring_02_r",
        "ring_03_r",
        "pinky_01_r",
        "pinky_02_r",
        "pinky_03_r",
        "thigh_l",
        "calf_l",
        "foot_l",
        "toe_l",
        "thigh_r",
        "calf_r",
        "foot_r",
        "toe_r",
        "heel_l",
        "heel_r",
        "shoulder_l",
        "shoulder_r",
        "forearm_twist_l",
        "forearm_twist_r",
        "upperarm_twist_l",
        "upperarm_twist_r",
        "thigh_twist_l",
        "thigh_twist_r",
        "calf_twist_l",
        "calf_twist_r"
      ],
      "loop_mode": "linear"
    },
    "jump": {
      "clip_ref": "jump",
      "duration_seconds": 1.2,
      "track_count": 68,
      "canonical_bone_ids": [
        "root",
        "pelvis",
        "spine_lower",
        "spine_mid",
        "spine_upper",
        "neck",
        "head",
        "jaw",
        "eye_l",
        "eye_r",
        "clavicle_l",
        "upper_arm_l",
        "lower_arm_l",
        "hand_l",
        "thumb_01_l",
        "thumb_02_l",
        "thumb_03_l",
        "index_01_l",
        "index_02_l",
        "index_03_l",
        "middle_01_l",
        "middle_02_l",
        "middle_03_l",
        "ring_01_l",
        "ring_02_l",
        "ring_03_l",
        "pinky_01_l",
        "pinky_02_l",
        "pinky_03_l",
        "clavicle_r",
        "upper_arm_r",
        "lower_arm_r",
        "hand_r",
        "thumb_01_r",
        "thumb_02_r",
        "thumb_03_r",
        "index_01_r",
        "index_02_r",
        "index_03_r",
        "middle_01_r",
        "middle_02_r",
        "middle_03_r",
        "ring_01_r",
        "ring_02_r",
        "ring_03_r",
        "pinky_01_r",
        "pinky_02_r",
        "pinky_03_r",
        "thigh_l",
        "calf_l",
        "foot_l",
        "toe_l",
        "thigh_r",
        "calf_r",
        "foot_r",
        "toe_r",
        "heel_l",
        "heel_r",
        "shoulder_l",
        "shoulder_r",
        "forearm_twist_l",
        "forearm_twist_r",
        "upperarm_twist_l",
        "upperarm_twist_r",
        "thigh_twist_l",
        "thigh_twist_r",
        "calf_twist_l",
        "calf_twist_r"
      ],
      "loop_mode": "explicit_landing"
    },
    "boxing": {
      "clip_ref": "boxing",
      "duration_seconds": 1.1,
      "track_count": 68,
      "canonical_bone_ids": [
        "root",
        "pelvis",
        "spine_lower",
        "spine_mid",
        "spine_upper",
        "neck",
        "head",
        "jaw",
        "eye_l",
        "eye_r",
        "clavicle_l",
        "upper_arm_l",
        "lower_arm_l",
        "hand_l",
        "thumb_01_l",
        "thumb_02_l",
        "thumb_03_l",
        "index_01_l",
        "index_02_l",
        "index_03_l",
        "middle_01_l",
        "middle_02_l",
        "middle_03_l",
        "ring_01_l",
        "ring_02_l",
        "ring_03_l",
        "pinky_01_l",
        "pinky_02_l",
        "pinky_03_l",
        "clavicle_r",
        "upper_arm_r",
        "lower_arm_r",
        "hand_r",
        "thumb_01_r",
        "thumb_02_r",
        "thumb_03_r",
        "index_01_r",
        "index_02_r",
        "index_03_r",
        "middle_01_r",
        "middle_02_r",
        "middle_03_r",
        "ring_01_r",
        "ring_02_r",
        "ring_03_r",
        "pinky_01_r",
        "pinky_02_r",
        "pinky_03_r",
        "thigh_l",
        "calf_l",
        "foot_l",
        "toe_l",
        "thigh_r",
        "calf_r",
        "foot_r",
        "toe_r",
        "heel_l",
        "heel_r",
        "shoulder_l",
        "shoulder_r",
        "forearm_twist_l",
        "forearm_twist_r",
        "upperarm_twist_l",
        "upperarm_twist_r",
        "thigh_twist_l",
        "thigh_twist_r",
        "calf_twist_l",
        "calf_twist_r"
      ],
      "loop_mode": "once"
    },
    "sword_attack": {
      "clip_ref": "sword_attack",
      "duration_seconds": 1.0,
      "track_count": 68,
      "canonical_bone_ids": [
        "root",
        "pelvis",
        "spine_lower",
        "spine_mid",
        "spine_upper",
        "neck",
        "head",
        "jaw",
        "eye_l",
        "eye_r",
        "clavicle_l",
        "upper_arm_l",
        "lower_arm_l",
        "hand_l",
        "thumb_01_l",
        "thumb_02_l",
        "thumb_03_l",
        "index_01_l",
        "index_02_l",
        "index_03_l",
        "middle_01_l",
        "middle_02_l",
        "middle_03_l",
        "ring_01_l",
        "ring_02_l",
        "ring_03_l",
        "pinky_01_l",
        "pinky_02_l",
        "pinky_03_l",
        "clavicle_r",
        "upper_arm_r",
        "lower_arm_r",
        "hand_r",
        "thumb_01_r",
        "thumb_02_r",
        "thumb_03_r",
        "index_01_r",
        "index_02_r",
        "index_03_r",
        "middle_01_r",
        "middle_02_r",
        "middle_03_r",
        "ring_01_r",
        "ring_02_r",
        "ring_03_r",
        "pinky_01_r",
        "pinky_02_r",
        "pinky_03_r",
        "thigh_l",
        "calf_l",
        "foot_l",
        "toe_l",
        "thigh_r",
        "calf_r",
        "foot_r",
        "toe_r",
        "heel_l",
        "heel_r",
        "shoulder_l",
        "shoulder_r",
        "forearm_twist_l",
        "forearm_twist_r",
        "upperarm_twist_l",
        "upperarm_twist_r",
        "thigh_twist_l",
        "thigh_twist_r",
        "calf_twist_l",
        "calf_twist_r"
      ],
      "loop_mode": "once"
    }
  },
  "semantic_actions": {